[
  {
    "id": "share-001",
    "clientId": "client-001",
    "name": "Q4 Audit for KPMG",
    "packId": "pack-001",
    "runId": "run-001",
    "audienceType": "auditor",
    "audienceName": "KPMG Russia",
    "audienceEmail": "audit@kpmg.ru",
    "clientSafe": false,
    "status": "active",
    "accessToken": "xK9mN2pQ5rT8vW1yZ4aB7cD0eF3gH6iJ",
    "expiresAt": "2025-03-31T23:59:59Z",
    "maxDownloads": 10,
    "downloadCount": 3,
    "lastAccessAt": "2025-01-15T10:30:00Z",
    "notifyOnAccess": true,
    "createdByUserId": "user-001",
    "createdAt": "2024-12-21T09:00:00Z"
  },
  {
    "id": "share-002",
    "clientId": "client-001",
    "name": "Tax Report for Advisor",
    "packId": "pack-002",
    "runId": "run-002",
    "audienceType": "advisor",
    "audienceName": "Tax Consulting LLC",
    "audienceEmail": "partner@taxconsulting.ru",
    "clientSafe": true,
    "status": "active",
    "accessToken": "mL4nO7pR0sU3vX6yA9bC2dE5fG8hI1jK",
    "expiresAt": "2025-04-30T23:59:59Z",
    "downloadCount": 2,
    "lastAccessAt": "2025-01-10T14:00:00Z",
    "notifyOnAccess": true,
    "createdByUserId": "user-001",
    "createdAt": "2024-12-19T11:00:00Z"
  },
  {
    "id": "share-003",
    "clientId": "client-002",
    "name": "Family Summary for Principal",
    "packId": "pack-007",
    "audienceType": "client",
    "audienceName": "Ivan Petrov",
    "audienceEmail": "ivan@family.com",
    "clientSafe": true,
    "status": "active",
    "accessToken": "qW2eR4tY6uI8oP0aS1dF3gH5jK7lZ9xC",
    "expiresAt": "2025-06-30T23:59:59Z",
    "downloadCount": 1,
    "lastAccessAt": "2025-01-05T16:30:00Z",
    "notifyOnAccess": false,
    "createdByUserId": "user-002",
    "createdAt": "2024-12-31T10:00:00Z"
  },
  {
    "id": "share-004",
    "clientId": "client-001",
    "name": "Bank KYC Update",
    "packId": "pack-003",
    "audienceType": "bank",
    "audienceName": "Sberbank Private",
    "clientSafe": true,
    "status": "expired",
    "accessToken": "vB3nM5kL7jH9gF1dS2aP4oI6uY8tR0eW",
    "expiresAt": "2024-12-31T23:59:59Z",
    "downloadCount": 5,
    "lastAccessAt": "2024-12-28T11:00:00Z",
    "createdByUserId": "user-001",
    "createdAt": "2024-11-15T14:00:00Z"
  },
  {
    "id": "share-005",
    "clientId": "client-003",
    "name": "PC Report for LP",
    "packId": "pack-005",
    "runId": "run-003",
    "audienceType": "client",
    "audienceName": "LP Investor Group",
    "clientSafe": true,
    "status": "active",
    "accessToken": "zX1cV3bN5mA7sD9fG0hJ2kL4pO6iU8yT",
    "expiresAt": "2025-03-31T23:59:59Z",
    "downloadCount": 0,
    "notifyOnAccess": true,
    "createdByUserId": "user-003",
    "createdAt": "2024-12-29T09:00:00Z"
  },
  {
    "id": "share-006",
    "clientId": "client-001",
    "name": "Previous Audit Share",
    "packId": "pack-006",
    "runId": "run-006",
    "audienceType": "auditor",
    "audienceName": "Deloitte",
    "clientSafe": false,
    "status": "revoked",
    "accessToken": "wE4rT6yU8iO0pA2sD4fG6hJ8kL0zX1cV",
    "expiresAt": "2025-01-31T23:59:59Z",
    "downloadCount": 7,
    "lastAccessAt": "2024-11-20T10:00:00Z",
    "revokedAt": "2024-12-01T09:00:00Z",
    "revokeReason": "Audit completed, access no longer needed",
    "createdByUserId": "user-001",
    "createdAt": "2024-10-10T11:00:00Z"
  }
]
